[
  {
    "id": 1,
    "name": "James Brown",
    "email": "james.brown1@example.com",
    "bio": "Full-stack engineer blogging about PHP internals."
  },
  {
    "id": 2,
    "name": "Grace Rodriguez",
    "email": "grace.rodriguez2@example.com",
    "bio": "Travel writer covering Southeast Asia."
  },
  {
    "id": 3,
    "name": "中村 健一",
    "email": "author33@example.com",
    "bio": "DevRel at a small startup."
  },
  {
    "id": 4,
    "name": "Noah Perez",
    "email": "noah.perez4@example.com",
    "bio": "DevRel at a small startup."
  },
  {
    "id": 5,
    "name": "Evelyn Williams",
    "email": "evelyn.williams5@example.com",
    "bio": "Data journalist covering climate topics."
  },
  {
    "id": 6,
    "name": "山口 太郎",
    "email": "author66@example.com",
    "bio": "Full-stack engineer blogging about PHP internals."
  },
  {
    "id": 7,
    "name": "Olivia Miller",
    "email": "olivia.miller7@example.com",
    "bio": "Travel writer covering Southeast Asia."
  },
  {
    "id": 8,
    "name": "Oliver Martin",
    "email": "oliver.martin8@example.com",
    "bio": "Full-stack engineer blogging about PHP internals."
  },
  {
    "id": 9,
    "name": "林 美咲",
    "email": "author99@example.com",
    "bio": "DevRel at a small startup."
  },
  {
    "id": 10,
    "name": "James Thompson",
    "email": "james.thompson10@example.com",
    "bio": "SRE turned technical writer."
  },
  {
    "id": 11,
    "name": "Charlotte Davis",
    "email": "charlotte.davis11@example.com",
    "bio": "Writer. Cat person. Occasional poet."
  },
  {
    "id": 12,
    "name": "清水 直樹",
    "email": "author1212@example.com",
    "bio": ""
  },
  {
    "id": 13,
    "name": "Emma Harris",
    "email": "emma.harris13@example.com",
    "bio": ""
  },
  {
    "id": 14,
    "name": "Mia Thompson",
    "email": "mia.thompson14@example.com",
    "bio": "料理と発酵食品について書いています。"
  },
  {
    "id": 15,
    "name": "吉田 直樹",
    "email": "author1515@example.com",
    "bio": "Front-end developer, typography nerd."
  },
  {
    "id": 16,
    "name": "Lucas Harris",
    "email": "lucas.harris16@example.com",
    "bio": "テックブログ執筆者。BEAR.Sundayが好き。"
  },
  {
    "id": 17,
    "name": "Noah Williams",
    "email": "noah.williams17@example.com",
    "bio": "料理と発酵食品について書いています。"
  },
  {
    "id": 18,
    "name": "高橋 あかり",
    "email": "author1818@example.com",
    "bio": "I write about sustainable gardening."
  },
  {
    "id": 19,
    "name": "Amelia Martin",
    "email": "amelia.martin19@example.com",
    "bio": "Freelance photographer and essayist."
  },
  {
    "id": 20,
    "name": "Liam White",
    "email": "liam.white20@example.com",
    "bio": "Writer. Cat person. Occasional poet."
  },
  {
    "id": 21,
    "name": "林 花子",
    "email": "author2121@example.com",
    "bio": "UX designer; sometimes I write too."
  },
  {
    "id": 22,
    "name": "Leo Williams",
    "email": "leo.williams22@example.com",
    "bio": "SRE turned technical writer."
  },
  {
    "id": 23,
    "name": "Isabella Lee",
    "email": "isabella.lee23@example.com",
    "bio": "Data journalist covering climate topics."
  },
  {
    "id": 24,
    "name": "山田 さくら",
    "email": "author2424@example.com",
    "bio": "Travel writer covering Southeast Asia."
  },
  {
    "id": 25,
    "name": "Henry Williams",
    "email": "henry.williams25@example.com",
    "bio": "Full-stack engineer blogging about PHP internals."
  },
  {
    "id": 26,
    "name": "Scarlett Davis",
    "email": "scarlett.davis26@example.com",
    "bio": ""
  },
  {
    "id": 27,
    "name": "加藤 花子",
    "email": "author2727@example.com",
    "bio": "I write about sustainable gardening."
  },
  {
    "id": 28,
    "name": "Sophia Brown",
    "email": "sophia.brown28@example.com",
    "bio": "料理と発酵食品について書いています。"
  },
  {
    "id": 29,
    "name": "Ethan Anderson",
    "email": "ethan.anderson29@example.com",
    "bio": "新米ライター。コーヒーと本をこよなく愛する。"
  },
  {
    "id": 30,
    "name": "山田 健一",
    "email": "author3030@example.com",
    "bio": "テックブログ執筆者。BEAR.Sundayが好き。"
  },
  {
    "id": 31,
    "name": "Amelia Miller",
    "email": "amelia.miller31@example.com",
    "bio": "新米ライター。コーヒーと本をこよなく愛する。"
  },
  {
    "id": 32,
    "name": "Ethan Thompson",
    "email": "ethan.thompson32@example.com",
    "bio": "UX designer; sometimes I write too."
  },
  {
    "id": 33,
    "name": "鈴木 さくら",
    "email": "author3333@example.com",
    "bio": "新米ライター。コーヒーと本をこよなく愛する。"
  },
  {
    "id": 34,
    "name": "Mia Moore",
    "email": "mia.moore34@example.com",
    "bio": "DevRel at a small startup."
  },
  {
    "id": 35,
    "name": "Sophia Garcia",
    "email": "sophia.garcia35@example.com",
    "bio": "Writer. Cat person. Occasional poet."
  },
  {
    "id": 36,
    "name": "佐々木 直樹",
    "email": "author3636@example.com",
    "bio": "UX designer; sometimes I write too."
  },
  {
    "id": 37,
    "name": "James Thompson",
    "email": "james.thompson37@example.com",
    "bio": "SRE turned technical writer."
  },
  {
    "id": 38,
    "name": "Sophia Perez",
    "email": "sophia.perez38@example.com",
    "bio": "テックブログ執筆者。BEAR.Sundayが好き。"
  },
  {
    "id": 39,
    "name": "佐藤 美咲",
    "email": "author3939@example.com",
    "bio": "I write about sustainable gardening."
  },
  {
    "id": 40,
    "name": "Liam Hernandez",
    "email": "liam.hernandez40@example.com",
    "bio": "料理と発酵食品について書いています。"
  },
  {
    "id": 41,
    "name": "Ethan Williams",
    "email": "ethan.williams41@example.com",
    "bio": "Travel writer covering Southeast Asia."
  },
  {
    "id": 42,
    "name": "清水 拓海",
    "email": "author4242@example.com",
    "bio": "DevRel at a small startup."
  },
  {
    "id": 43,
    "name": "Mason Miller",
    "email": "mason.miller43@example.com",
    "bio": "新米ライター。コーヒーと本をこよなく愛する。"
  },
  {
    "id": 44,
    "name": "Harper Gonzalez",
    "email": "harper.gonzalez44@example.com",
    "bio": "UX designer; sometimes I write too."
  },
  {
    "id": 45,
    "name": "松本 健一",
    "email": "author4545@example.com",
    "bio": "Freelance photographer and essayist."
  },
  {
    "id": 46,
    "name": "Ava Davis",
    "email": "ava.davis46@example.com",
    "bio": "DevRel at a small startup."
  },
  {
    "id": 47,
    "name": "Evelyn Moore",
    "email": "evelyn.moore47@example.com",
    "bio": "Freelance photographer and essayist."
  },
  {
    "id": 48,
    "name": "清水 翔太",
    "email": "author4848@example.com",
    "bio": "UX designer; sometimes I write too."
  },
  {
    "id": 49,
    "name": "Jacob Gonzalez",
    "email": "jacob.gonzalez49@example.com",
    "bio": "テックブログ執筆者。BEAR.Sundayが好き。"
  },
  {
    "id": 50,
    "name": "Sophia Jones",
    "email": "sophia.jones50@example.com",
    "bio": "SRE turned technical writer."
  }
]